{"v": 1, "id": "01JA2B3C4D5E6F7G8H9JKMNPQS", "received_at": "2026-10-15T09:00:00.123Z", "monitor": {"token": "abcdefghijklmnopqrstuvwxyz"}, "unverified": false, "source": "http", "idempotency_key": null, "metrics": {}, "metrics_rejected": [], "output": null, "output_truncated": false, "kind": "start", "run_id": "01JA2B3C4D5E6F7G8H9JKMNPQR", "exit_code": null}
